{
  "$schema": "https://json-schema.org/draft/2020-12/schema",
  "$id": "https://s9-knowledge/contracts/knowledge-v3/v1/fact-assertion-v3.schema.json",
  "title": "fact-assertion/v3-internal-v1",
  "description": "Unidad autoritativa del ledger temporal. La arista directa del grafo es una PROYECCION; la verdad vive aqui. La historia nunca se borra: se supersede.",
  "type": "object",
  "additionalProperties": false,
  "required": [
    "contract_id", "contract_version", "workspace", "source_asset_id", "source_hash",
    "provider_trace", "assertion_id", "subject_entity_id", "object_entity_id",
    "predicate", "direction", "valid_from", "valid_to", "recorded_at",
    "epistemic_status", "confidence", "status", "collection_id", "game_profile",
    "engine_version", "ontology_version", "evidence_fragment_ids", "episode_ids",
    "supersedes", "superseded_by"
  ],
  "properties": {
    "contract_id": { "const": "fact-assertion/v3-internal-v1" },
    "contract_version": { "$ref": "_common-v3.schema.json#/$defs/contract_version" },
    "workspace": { "$ref": "_common-v3.schema.json#/$defs/workspace" },
    "source_asset_id": { "$ref": "_common-v3.schema.json#/$defs/stable_id" },
    "source_hash": { "$ref": "_common-v3.schema.json#/$defs/hash" },
    "provider_trace": { "$ref": "_common-v3.schema.json#/$defs/provider_trace" },

    "assertion_id": { "$ref": "_common-v3.schema.json#/$defs/stable_id" },
    "subject_entity_id": { "$ref": "_common-v3.schema.json#/$defs/stable_id" },
    "object_entity_id": { "$ref": "_common-v3.schema.json#/$defs/stable_id" },
    "predicate": { "$ref": "_common-v3.schema.json#/$defs/predicate" },
    "direction": { "$ref": "_common-v3.schema.json#/$defs/direction" },
    "valid_from": { "$ref": "_common-v3.schema.json#/$defs/iso8601_utc_or_null" },
    "valid_to": { "$ref": "_common-v3.schema.json#/$defs/iso8601_utc_or_null" },
    "recorded_at": { "$ref": "_common-v3.schema.json#/$defs/iso8601_utc" },
    "epistemic_status": { "$ref": "_common-v3.schema.json#/$defs/epistemic_status" },
    "confidence": { "$ref": "_common-v3.schema.json#/$defs/confidence" },
    "status": {
      "type": "string",
      "enum": ["PROVISIONAL", "ASSERTED", "CONFIRMED", "LIMITED", "SUPERSEDED", "CONTRADICTED", "RETRACTED"]
    },
    "collection_id": { "$ref": "_common-v3.schema.json#/$defs/stable_id" },
    "game_profile": { "$ref": "_common-v3.schema.json#/$defs/game_profile" },
    "engine_version": { "type": "string", "minLength": 1, "maxLength": 64 },
    "ontology_version": { "type": "string", "minLength": 1, "maxLength": 64 },
    "evidence_fragment_ids": {
      "type": "array",
      "minItems": 1,
      "description": "Sin evidencia no hay afirmacion. Nunca vacio.",
      "items": { "$ref": "_common-v3.schema.json#/$defs/stable_id" }
    },
    "episode_ids": {
      "type": "array",
      "minItems": 1,
      "items": { "$ref": "_common-v3.schema.json#/$defs/stable_id" }
    },
    "supersedes": { "$ref": "_common-v3.schema.json#/$defs/stable_id_or_null" },
    "superseded_by": { "$ref": "_common-v3.schema.json#/$defs/stable_id_or_null" },
    "negated": { "type": "boolean" },
    "metadata": { "$ref": "_common-v3.schema.json#/$defs/metadata" }
  },
  "allOf": [
    {
      "$comment": "Una afirmacion superada DEBE decir quien la supera; si no, la historia se pierde.",
      "if": { "properties": { "status": { "const": "SUPERSEDED" } }, "required": ["status"] },
      "then": {
        "properties": { "superseded_by": { "$ref": "_common-v3.schema.json#/$defs/stable_id" } },
        "required": ["superseded_by"]
      }
    }
  ]
}
