{
  "assertion_id": "assertion:0000",
  "collection_id": "collection:campana-leyenda",
  "confidence": 0.79,
  "contract_id": "fact-assertion/v3-internal-v1",
  "contract_version": "1.0.0",
  "direction": "SUBJECT_TO_OBJECT",
  "engine_version": "3.0.0",
  "episode_ids": [
    "episode:manual-001:p12"
  ],
  "epistemic_status": "ASSERTED",
  "evidence_fragment_ids": [
    "fragment:p12:0"
  ],
  "game_profile": "generic",
  "negated": false,
  "object_entity_id": "entity:casa-del-ciervo",
  "ontology_version": "core-1.4.0",
  "predicate": "MEMBER_OF",
  "provider_trace": [
    {
      "model": null,
      "name": "s9k.knowledge_v3",
      "produced": [
        "predicate",
        "direction",
        "status"
      ],
      "provider": "local",
      "step": "engine.decide",
      "version": "3.0.0"
    }
  ],
  "recorded_at": "2026-06-01T09:00:00Z",
  "source_asset_id": "asset:manual-001",
  "source_hash": {
    "algorithm": "sha256",
    "value": "a900b2ece307794d62690e1ffbe35853112ebbdef8fe18061b62f896d38f23a2"
  },
  "status": "SUPERSEDED",
  "subject_entity_id": "entity:daiki",
  "superseded_by": "assertion:0001",
  "supersedes": null,
  "valid_from": "1041-01-01T00:00:00Z",
  "valid_to": "1042-02-28T00:00:00Z",
  "workspace": "leyenda"
}
